Why are you not satisfied with the team selection process?,Satisfied with the process,Not satisfied with support,Why are you satisfied with the team selection support provided by the Jobs tool?,What could make team selection better for you and other campers?,"What, if anything, would you like to tell the Hiring Hub and Mission control teams that you haven’t had the chance to share?",Q13: How can the Jobs tool better support your team selection process?
"As a manager camper, the process was different than others.  There were limited options I was asked to consider.","A little bit tight but nice to sit with different teams, everyone are nice.",Because it doesn’t reflect reality or positions properly. I got on a team which wasn’t on the tool. Also there are no notes specific to the sub team or responsibilities the manager is recruiting towards.,1. Not every team has openings posted on Jobs. I got several reachouts in workchat. 2. Does include all teams. Wish it can be a one stop team search including all teams and it's ok if only some of them has openings.,Bootcamp tool is a bit hard to use;  Many of the descriptions of the positions are poor; People don't seem to respond to the notifications made within the tool,"All teams and hiring managers should put direct work into the descriptions on the Jobs tool. Many teams I came across aggregated their jobs tool listings together by large org, so there was no visibility until you actually sit with the team to the kind of work you would actually be doing. This was a huge waste of time.",Accurate and comprehensive information
Availability of information about teams in a consistent format was not available. Too many options available to choose from.,Ability to sit and work with teams made me more confident in my selection,"Because the reachouts feature of the tool was useless. Managers responded to workplace chats, but never to reachouts from the tool.","Although not very frequently updated, I get to see a wide selection of teams.",Many team selection presentations were not useful at all as a PE. Many presenters were working with information about existing teams and openings that were completely outdated.,"As frustrating as finding a team in bootcamp is, it was still a great experience.",allow more specific searches for areas of interest (like security)
Expectations of the team are not clear at the start. Was told teams are not evaluating candidates but only candidates are evaluating team but this does not seem to be true. Teams do not seem to spend too much thought on bootcamp tasks. ,Able to sit in the team and talk to people,Difficult to find POCs for all teams; not all teams had up to date descriptions which made it difficult to figure out if I wanted to speak more with the team,can check the status of reachouts,More initial information about the teams,Be more explicit that bootcamper can actively reach out to teams. Both in the tool and on mentor level. I was not aware such option is not discouraged.,Delete jobs that don't have headcount attached.
"I and several other bootcampers felt frustrated that there was a minimum number of teams to sit with. We already knew which teams we wanted to join, but the requirement forced us to sit with other teams, which was a waste of their and our time. ",Able to sit with and evaluate teams in a more meaningful way.,https://fb.workplace.com/groups/bootcamp/permalink/2118316671550836/,"Central access to data about teams and products. However, would have liked to see more features to help organize the teams evaluation. Saw multiple spreadsheets and evaluation points, those could be build into the tool to ease the process for bootcampers.",The head count information is not up to date in job tool. Managers may reach out without headcount ready. Managers may fill headcount without notifying.,Consider not restricting Jobs searches by geographic location.,"first and foremost, better teams search, even for teams that don't have open roles at the moment"
"I found the reachouts feature of the Job tool entirely useless. Only 1 team reached out to me during bootcamp, and then a second after I selected a team. I sat with teams by reaching out to them individually and asking to sit with them. ","Access to teams, managers' responsiveness ","I searched ""music"" or ""audio"" and none of the music or audio teams that were hiring came up. ",clear,The tooling is insufficient to manage the interaction between the candidate and teams.  The contact tool is okay for initial contact but then stops being useful.  Scheduling when to bootcamp with each team also happens independently of the tool.,don't think people should be forced to do/not do anything but rather have more recommendations available,I didnt reflect the real situation of the jobs
"I joined a team on a Thursday but manager told he will switch team next Tuesday. I feel if some manager is in the process of changing team, they should not hire. ",Allowed me to get introduced to different teams and people in the site. Understand the differences and what's important and less important for me. Allowed me to feel the vibe of the team and connection to the team members. ,"It doesn't provide an accurate view of what teams are hiring.  The team I picked didn't have headcount when I started team selection, and only had headcount right as I made a decision.",Clearly lists jobs. Can save the ones you like. Can reachout to teams,To have some high level understanding of what each org is doing or undergoing at the beginning will be helpful to have a better targeted list of teams to narrow down.,Each team should have a very clear set of expectations on what constitutes a success at the end of the bootcamp week with them. ,I wish there was an easier way to filter by technologies used and other areas
"I suggest not restricting bootcamper's job tools to a specific geographic location. This put me in a difficult situation where the team I was pre-allocated for got re-orged away, but I couldn't search for new teams elsewhere in the company because I was geographically restricted. I had to instead spend an inordinate amount of time ""networking"" to find roles within the company, a very difficult and time consuming process for a new hire. ",Allows you to sit with a many teams around the company and understand a lot of the cool problems we tackle every day.,It's so bad. Two managers that I reached out to didn't realise they couldn't respond via the Jobs tool (b/c apparently the box they thought was for replying is for 'comments'). So I ended up not hearing back from either for like 2 weeks. ,ease of use,"Transparency of pulse scores in Jobs tool, attrition rates/plans, WLB exceptations","Even if I reach out to mentors, many seemed to not want to lead the process. I had to book my own meetings and keep trying to follow up :( Also for teams I did work with, I was given “baby” tasks that changed ~10 lines of code so it felt like I wasn’t really getting to know the team. I found it hard to find open AR/VR teams (I only found three). ",Improve the job listings and filters.
I tried to work with five teams but I didn't had the time to finish or even start the task I got,"As a PE, I didn't have too many teams to choose from, it was easy to select ones to sit with and spend a meaningful time with each team (week per team)",Jobs tool does not contain the updated list of positions available,Ease of use,,"Everything mentioned in ""How would you feel if the following would be present for team selection?"" question above is a must have!","Include reason why manager reached out to me. Will save a lot of time on communications. Better information on location of teams, including desk space."
"It is very long. Personally i didn't see much value in sitting with multiple teams for few days. It is not possible to get any insight and inclination just by working few days. Talking with manager and one or two team members is sufficient know whether you like working in the team. Given the pressure of PSC, i would rather end team selection quickly and spend more time with team to ramp up.",Because I believe I was able to choose the team that was best for me,Level was broken. Many positions that said required IC4/5 were actually accepting IC3.,Easy to use,,"For many teams in the jobs tool list the information is not up to date. So sometimes you click into a team and all the info is empty, no tasks and no head count listed. Yet they have head count. And sometimes I reach out to teams and they said they are not looking. This ends up wasting time and increases noise.","Its a data problem really, managers don't keep it up to date. Also a lot of things around headcount/role are flexible and the tool doesn't indicate that."
It was kind of chaotic and it would have been nice if there was a more formal first introduction to the team meeting preferably with a manager. I don't think it has to be used but managers should be trained on how to run those meetings in order to make it more welcoming for incoming employees.,Because I got on the perfect team fully convinced that I had enough of an opportunity to understand my choices,Managers are hard to reach and reasons for their decisions are not clear. This does not apply to all but for majority of managers I was trying to reach out.,Easy to use.,,"guidelines for what should be done *during* the team selection week, should be clearer. There were differences between teams.","managers should keep the job tool updated, especially for the headcount info."
"It's basically a race, as who says ' I want the spot' first gets it, and there are bootcampers from previous batches and from the same batch looking at the same team as you. I also think teams should be required to let bootcampers that they know are interested on the team know as soon as the spot is filled.",Because I was preallocated. Super easy and low pressure process for me.,NA,everything is there,,"I am a rotational software engineer, so the main difficulty for me was that no teams reached out to me - I had to find everyone by myself :) ","More accurate position info (description, level, availability, team members, etc.)"
"Job descriptions don’t exist in the jobs tool, hard to search for teams, not many oculus choices available","Being able to explore different teams increased the chances of a great match. I think the time I took with each time (one week) was appropriate, in order to be able to properly work on tasks and finish them.",not fully in sync of what was offered. ,Generally good initial overview of the teams available through Jobs tool helped make a decision to move forward and talk to hiring manager,,"I am hired as ML engineer and as such, the volume of reachouts is rather small compared to new grad colleagues, so my problems with the tool are slightly different. Despite small number of reachouts, many teams have potential of getting headcount and are open to conversation for ML engineers, even if they are not shown in the Jobs tool. I found out about some teams only in weeks 5+,  through networking. Finding such teams should be easier in the jobs tool. One more thing is that rejections should include at least a small reason, or a dropdown menu (for managers also). Seeing a rejection email without any detail is just weird, but after reaching out to a manager afterwards, very simple and understandable explanations are usually received.",Most of the team selection process is not thorough the jobs tool so it doesn't help much beyond sending an initial message. I used my own separate notes to keep track of teams. 
"Jobs tool did not tell me about numerous jobs that were available and related to my specific interests, as a result, all of my searches turned up junk results and I am on a team that is not aligned with my interests","Bootcamp is awesome, plus the idea of sitting with the team to learn about their projects","The jobs tool is buggy and also can't reasonably filter out teams I've declined or who declined me. It's hard to stay focused using it because you have to sift through teams that clearly aren't a match (one or both parties has rejected the other, or the office is in the wrong location). Also, teams don't fill out their jobs tool descriptions accurately. ",Generally Jobs tool is useful and easy to use.,,I dislike enforced rules. Instead I would prefer signal / advice that I can choose to heed or ignore.,"Provide a more consistent overview across the teams, in terms of what a team works on, upcoming projects, etc.."
Limited and non-diverse selection of teams to choose from.,"Chance to team select, removal of FOMO that way",The jobs tool was not accurate and there was a mismatch between the real jobs available and the ones in the the tool,Good amount of description and open positions helped me.,,"I ended up joining a portal software team, but in the jobs tools it was listed under a broad org of 80-90 people. This wasn't very useful. It would be nice if a breakdown of teams was available in the jobs tool.",Provide suggestions on suitable teams
"Managers need to understand the rules better. A manager let me sit with his team, and then when I said he wanted to join he told me he was looking at an internal transfer and waiting to hear back from another bootcamper .  Completely wasted my time. ",Ended up working fine; I'm on a good team.,"There is no way to keep track of my notes and communications with the hiring managers. All of the communication with hiring managers and with my mentor should be consolidated into an easy to reference, search and sort tool.","Good filtering.  When combined with the Org Tool, could figure out how a team fit within their larger Group/Pillar.  Could see all job openings (even if not an ideal personal fit).",,I feel like limiting choices and preallocating to pillars may cause a lot of frustration and remove the freedom that made my bootcamp experience awesome.,"Showing the last updated date, having more personal filters. being able to track better."
"Mentor wasn't too helpful with talking through the decision making process. Sitting with a team for 3-4 days isn't enough to really find out about their work culture, and many things only surface a week or two after joining the team.","enough time to work with teams, no pressure",,"Good tool, a bit overwhelming to be honest",,"I found the flexibility very valuable and I was glad I was able to join an ""ML Generalist"" position even though I was hired as a ""Systems Generalist"".",Up to date information about open positions.
"Mostly self-inflicted.  I rushed team selection, seeking to join a team before the too-new-to-evaluate cutoff, which meant I didn't properly evaluate the teams long enough.  Although less a reflection of the bootcamp team, I hope they will make it more clear rushing is not valuable in the future.",Everyone was extremely friendly and supporting throughout the entire process,,Good UI for reachouts,,"I guess the job tool can be a little more of an app, rather than a page. I remember my experience was relatively poor due to dozens of simultaneously open browser tabs without any relation between them. Reach-outs here, team profile there, team tasks in the third one, repeat for 3-5 teams. Totally possible that I used it incorrectly, though.",Would be much more convenient if I can put some notes/tag some people (for personal usage) in the tool. Also more statuses to choose would be helpful.
"Some managers lied about the headcounts. The headcounts were available on job tool, but the managers said no. I sent an email to Keri Salemme on Mar. 29, 2019 at around 5:32PM EDT about the details. Relevant link: https://fb.workplace.com/groups/bootcamp/permalink/2118316671550836/",expectations are clear; campers have lots of flexibility and choice,,had a good reachout tool however a lot of teams hadn't updated their team descriptions so I had to wait till teams reached out to me or ask my friends for recommendations.,,"I have witnessed hiring manger or engineers from certain teams tried to pressure bootcampers to join by telling them their teams are running out of headcounts (but in fact they aren't), and that the bootcamper needs to make a decision soon or by a certain date. That is cheating. I think that is unfair to teams who play by the rules and have multiple headcounts open.",
"Some teams with open positions matching my stream, when I expressed my interest after sitting with their team and working on a task, they rejected my candidacy. This happened with multiple teams. It was a waste of my time as bootcamper which I could have used to spend with teams who are actually looking to hire.",Feel like I'm on a supportive team that I can enjoy working with,,I can see the diffs and tasks in a team.,,"I like the flexibility of reaching out to any team and having any team reach out to me, would hate to lose that, but having visibility through dashboards sounds like a great way to filter",
Team I initially chose (assistant reasoning team) told me the lost the head count to an external hire after being specifically told the head count was allotted for me.,"Flexibility, able to talk to teams, teams are friendly",,"I ended up on a good team.  Also, this is a rough question.  It isn't easy to know how I should be answering this.",,I never knew that I'd join the team and position I joined. Neither did many of my friends. I think the freedom in choosing the team is the greatest asset of current program.,
Team selection process added uncertainty to hiring process and since I already knew about the research one team is doing I decided to ask for pre-allocation before signing the contract. During bootcamp I realized that it would have been better if I followed the regular process. After sitting with the team for a week I discovered that our work styles differ a little. It took me the last few months to align that.,Found a good team.  Got extra time to find a team when first choice filled up.  Had plenty of time to acclimate to the company and team.,,I felt like the jobs tool was good in the initial reach-out process but there is not much need for it after talking to the hiring manager. ,,I received 50+ reachouts and I know many others do as well. That is a waste of camper and managers' time. Recommendation and ranking is a must have ,Total
The team selection tool didn't reflect the teams actually interested in bootcampers,Found a team that I liked joining. ,,"I really like the team page description, ability to read diffs, wiki etc. I liked the reachouts page too.",,I think it's really great that FB invests the resources into allowing bootcampers to find a team they would match well with and I'm well aware that many other companies simply have no such thing. I'd suggest inserting a segment into NHO talking about how to evaluate a team and some heuristics for knowing if a team is a good fit for a bootcamper's skills and personality. I know of peers who go into team selection with no clue what to look out for and end up choosing a team based on trivial factors.,8
"The way team selection happens, it's so overwhelming that I found it very hectic and felt lot of pressure while going through it.",Found a team that satisfied the majority of my criteria,,I really only used the reachout tool... everything else (logistics etc) was done elsewhere ie workchat,,"I think that what the tool did was not made very clear during bootcamp. I was unsure what ""accept/reject"" for a team would do, and I didn't know if I should reach out to the manager or if they got a notification. I think having more transparency about what can be see in the whole process would be useful.",6
There was not place to find which teams are hiring. We had to ping managers around and find if they had headcount,"Found an awesome team to join, easy to find teams in tool",,"I think it worked fine, but it was misleading at first, it released the reach outs a little bit later than scheduled which caused a little bit of confusion",,"I think the experience may be very different based on office size. I think it is important to not optimize for one setting at the expense of others, for example if filtering by skills was enforced globally it might make finding teams in smaller offices harder.",2
"Time is too short! First, though we have 2 weeks, we want to speak to probably 5 managers or more bc I think many of us don't really know what the teams are doing. Second, after we talk to the manager, we will need to talk to PM/EM/DS/DE or let's say at least 2 other people in the team. That will triple the number(let's say you've narrow down to 3 teams already, then you'll meet 9 people). Third, Wed. usually cannot have meetings so we have 8 days in total. Fourth, we want to sit with the team for at least 1 day, this takes time and comes in order. Fifth, I think FB didn't tell the bootcampers how intense/little time they have to during team selection, so many of them are not prepared to speed up the process. Sixth, we sometime need to do task with the team so it requires more time. In general, I will say most bootcampers will consider: choosing the right team is their most important task during bootcamp so either we should get more time(Analytics track), or we need to be warned to be quick before the team selection.  ",Freedom to pick what I want to work on,,I was able to find teams I liked,,"I think the hardest part is the scheduling and figuring out how to fit all the teams you want to try together. If the jobs tool could help with logistics more, that'd be great.",1
Too many conversations to be made in short period of time; difficult to schedule; pushing from managers - supposed to be positive but in fact it feels negative.,Gave me enough time to go through different teams and spend time with some of the teams before finalizing team.,,I was able to see all the teams with head counts and sort them based on my interests and skills,,"I think there are several groups of people (new grads, new to high tech, etc.) that don't fully take advantage of the job finding process.  Those people could use better tooling or maybe more limited choices.",1
"When accepting an offer from Facebook, a big component is understanding what team we might join. I had expected to join a particular team from discussions before joining, but when I arrived I was told that team I intended to join no longer had headcount. The team selection process has too much chance involved - this is especially important for senior candidates.",Gave me opportunity to find a team that was a good match,,I was able to use it for what I needed,,I was preallocated so i didn't to through team selection,1
,Generally had the resouces available in my mentor and bootcamp program organizers to narrow down my list of teams in consideration,,It allowed me to browse the available options and facilitated reaching out to managers,,"If possible, provide like filter things in the profile. For example, I only want to join a team using C++ and really don't consider the teams using other languages. In that case, I want some teams can filter me out when they do reach outs :) ",
,Get to see what's available at FB.,,"It allowed me to have a central location for all positions, respond quickly to ones I was not interested in.",,"It is important for people to ask how tasks are assigned within teams, since it has a large effect on team culture.",
,Get to try out tons of different teams and learn what you want to do,,It did everything that I needed it to do.,,It'd be helpful if teams updated the Jobs tool more often.,
,given chances of experiencing multiple teams,,It does the job,,It's sometimes hard to understand what a team does based on its team page.,
,Given time to explore widely varying teams. Teams were friendly to sit down with.,,It gives you a lot of data but you need to filter a lot first too.,,"Managers being upfront on whether they are evaluating you for the team will be helpful. If they are looking for a specific skill set or in general efficiency in getting the task done, they should be really open about it. Being told it's not a fit AFTER a week spent with the team is a week wasted when there are 20+ reachouts. ",
,Giving people the autonomy to choose their own team made the experience great,,It got the job done for the most part,,More transparency towards headcount and intention of hire. Mandatory requirement for teams to post roadmap.,
,Good communication process,,"It lists out details and tasks related to the team, even though tasks aren't much useful since they are random bug fixes. ",,no,
,"Good selection of teams, opportunity to sit with a team for a few days ",,"It makes a lot of things simple (e.g. filtering by theme / pillar / IC levels + keeping track of everything). Unfortunately some teams don't make the effort of updating their presence on the tool, so networking is still necessary in some situations.",,"Nothing more, thank you",
,got a chance to work with the team and learn about the culture and also about the product a little.,,It offered a way to organize what felt like an overwhelming amount of teams and reach-outs.,,org chart is a useful tool during team selection to see potential team members.,
,got chance to explore different teams,,"It provided the ability to keep teams in the queue or dismiss teams I wasn't interested in, which was useful.",,please improve this question - I don't know what these teams are responsible for. ,
